order_original,orientation,competence_ru,question_ru
12,прошлое,план сессии и отчет,"Я корректировал(а) составленный ранее план терапии, если понимал(а), что назрели правки"
13,прошлое,принятие,"Я с уважением относился(лась) к решениям клиента, даже если не до конца понимал(а) их"
14,прошлое,интерпретации,"Я акцентировал(а) внимание клиента на том, что его действия, слова и чувства могут иметь определенный психологический смысл"
15,прошлое,резюмирование,Я избегал(а) переспрашиваний в процессе работы
16,прошлое,самооценка,"Я анализировал(а) проведенные мною сессии, чтобы выявить свои зоны развития"
17,прошлое,пауза,"Я молчал(а), когда не знал(а), как продолжить работу"
18,прошлое,информация о психических процессах,"Я использовал(а) свои знания о психических процессах, чтобы объяснить клиенту то, что с ним происходит"
19,прошлое,интерпретации,Я не раскрывал(а) клиенту свое видение его случая
20,прошлое,концептуализация случая,"Я переформулировал(а) клиенту его слова, согласно модели терапии, в которой я работаю"
21,прошлое,Поддержание результатов,Я акцентировал(а) внимание клиента на его достижениях
22,прошлое,конгруэнтность,"На вопросы клиента о моих чувствах я давал(а) честный ответ, даже если это могло задеть его"
23,прошлое,эмпатия,"Когда я слушал(а) клиента, представлял(а), что бы я чувствовал(а), если бы эти события произошли в моей жизни"
24,прошлое,Поддержание результатов,"Я не обсуждал(а) с клиентом то, что уже достигнуто, а фокусировался(лась) на том, что еще не сделано"
25,прошлое,информация о психических процессах,"Я не объяснял клиенту, как работает его психика, так как считаю, что осознавание этого происходит (должно происходить) в процессе работы"
26,прошлое,понятность,"Я использовал(а) психологические термины, чтобы завоевать доверие клиента"
27,прошлое,невербальные навыки,"Я уделял(а) внимание смыслу сказанного клиентом, а не его невербальным проявлениям"
28,прошлое,концептуализация случая,"Я делал(а) концептуализацию случая только на первой встрече, а дальше уже работал(а) с проблемой"
29,прошлое,эмпатия,"Я уделял(а) больше внимания решению проблем клиента, а не разговорам о его чувствах"
30,прошлое,вопросы,"Я использовал(а) вопросы только для сбора информации, а не для продвижения терапевтического процесса"
31,прошлое,навыки тайм-менджмента,"Я обнаруживал(а) на сессии, что время вдруг подошло к концу"
32,прошлое,невербальные навыки,Я не подстраивался(лась) под позу и манеру речи клиента
33,прошлое,резюмирование сессии и результатов терапии c клиентом,"Я не выделял(а) значимые моменты сессии для клиента, поскольку он сам запоминает самое важное"
34,прошлое,невербальные навыки,Я обращал(а) большое внимание на невербальные проявления клиента
35,прошлое,принятие,"Когда я слушал(а) клиента, то смотрел(а) на него, активно поддерживая контакт"
36,прошлое,пауза,"Если в разговоре с клиентом возникала пауза, я старался(лась) ее чем-то заполнить"
37,прошлое,вопросы,"Я хорошо понимал(а), что я спрашиваю у клиента и зачем"
38,прошлое,обратная связь,"Когда клиент был недоволен и не ценил проделанную работу, я расстраивался(лась) и говорил(а) клиенту о своих чувствах"
39,прошлое,понятность,"Я использовал(а) метафоры и аналогии, чтобы клиенту было понятнее, что я имел(а) в виду"
40,прошлое,обратная связь,Я использовал(а) шкалы обратной связи
41,прошлое,оценка результатов,Во время сессии я сопоставлял(а) изначальный запрос клиента и текущие результаты
42,прошлое,стимуляция,"Если клиент сам не рассказывал подробно о чем-то, я не просил(а) клиента рассказать больше"
43,прошлое,интерпретации,"Я не использовал(а) интерпретации, чтобы не исказить субъективный опыт клиента"
44,прошлое,Поддержание результатов,"Я поддерживал(а) в клиенте ощущение веры в свою способность достичь цели, напоминая о его предыдущих успехах"
45,прошлое,обратная связь,"Когда клиент негативно отзывался о том, что происходило на сессии, я старался(лась) понять, что именно его не устраивало"
46,прошлое,резюмирование,Я резюмировал(а) слова клиента
47,прошлое,резюмирование сессии и результатов терапии c клиентом,"Я подводил(а) итог сессии, только если об этом просил клиент"
48,прошлое,альтернативные взгляды,"Я не привносил(а) информации, противоречащей взгляду клиента"
49,прошлое,челендж (работа с затруднениями),"Когда я наблюдал(а) у клиента какой-то дисфункциональный процесс/убеждение или внутреннее противоречие, я прямо указывал(а) на это"
50,прошлое,понятность,Я говорил(а) с клиентом понятным ему языком
51,прошлое,информация о психических процессах,Я информировал(а) клиента о способах совладания с негативными эмоциональными состояниями
52,прошлое,информация о психических процессах,"Я говорил(а) клиенту, как его эмоциональное состояние может влиять на его физическое самочувствие"
53,прошлое,конгруэнтность,Я открыто делился своими чувствами с клиентом во время сессии
54,прошлое,резюмирование,По следам рассказа клиента я обобщал(а) суть его переживаний и размышлений
55,прошлое,пауза,"Я предлагал(а) клиенту помолчать, чтобы обратить его внимание на то, что с ним происходит"
56,прошлое,концептуализация случая,"Я дополнял(а) концептуализацию случая клиента новой информацией, которую получал(а)"
57,прошлое,интерпретации,Я просил(а) клиента говорить о своих чувствах и мыслях и не предлагал(а) своих интерпретаций
58,прошлое,оценка результатов,"Я просил(а) клиента рассказывать мне о том, как он оценивает свой прогресс"
59,прошлое,резюмирование сессии и результатов терапии c клиентом,Я специально оставлял(а) время в конце сессии для подведения итогов
60,прошлое,Поддержание результатов,"Я не отмечал(а) незначительные изменения клиента, пока проблема не была полностью решена"
61,прошлое,перефразирование и пересказ,Я повторял(а) сказанное словами клиента
62,прошлое,вопросы,"Задавая вопросы клиенту, я опирался(лась) на интуицию"
63,прошлое,резюмирование сессии и результатов терапии c клиентом,"В конце сессии я уточнял(а) у клиента, что он считает результатом сессии"
64,прошлое,альтернативные взгляды,"Я рекомендовал(а) клиенту ознакомиться с дополнительной информацией (исследования, книги, статистические данные, статьи и др.), которые не совпадают с его убеждениями"
65,прошлое,понятность,"Клиент спрашивали меня о том, что я имел(а) в виду"
66,прошлое,контекст,"Я возвращал(а) клиента к изначальному плану терапии, если он отвлекался на другие цели"
67,прошлое,концептуализация случая,"Мне не было нужно подробно расспрашивать клиента о его проблеме, поскольку я сразу понимал(а), что с ним происходит"
68,прошлое,стимуляция,Я просил(а) клиента на сессии усилить невербальные проявления чувств и переживаний
69,прошлое,конгруэнтность,"Я старался(лась) не показывать клиенту свои чувства, возникающие в процессе терапии"
70,прошлое,план сессии и отчет,Я намечал(а) план на каждую сессию
71,прошлое,резюмирование,После рассказа клиента я кратко резюмировал(а) ему суть сказанного
72,прошлое,поддержка,"Я отслеживал(а) степень проявления заботы о клиенте, чтобы не формировать зависимость от терапевта"
73,прошлое,альтернативные взгляды,Я старался(лась) не влиять на убеждения клиента
74,прошлое,оценка результатов,"Я использовал(а) специальные инструменты для подведения промежуточных итогов (например, шкалы или вопросы)"
75,прошлое,концептуализация случая,"Я задавал(а) вопросы, необходимые для концептуализации случая клиента"
76,прошлое,стимуляция,"Я использовал(а) фразы «расскажите больше о…», «а что еще…?»"
77,прошлое,прямое руководство,Я предлагал(а) клиенту варианты поведения в определенных ситуациях
78,прошлое,контекст,"В начале сессии я обсуждал(а) с клиентом, с чем бы он хотел поработать сегодня"
79,прошлое,план сессии и отчет,Я не составлял(а) отчёт после каждой сессии
80,прошлое,гибкость и адаптивность,"Я менял(а) план работы, в зависимости от того, что происходило на сессии"
81,прошлое,перефразирование и пересказ,"Я уточнял(а) у клиента, правильно ли я его понимаю"
82,прошлое,оценка результатов,"Я не задавал(а) клиенту вопросы про результаты терапии, так как, когда они появятся, это станет само собой заметно"
83,прошлое,вопросы,"Я задавал(а) вопросы, ориентируясь на поставленную цель терапии"
84,прошлое,гибкость и адаптивность,"Я адаптировал(а) свою работу в зависимости от потребностей, актуальных для клиента"
85,прошлое,план сессии и отчет,После завершения сессии я обдумывал(а) произошедшее на ней
86,прошлое,поддержка,"Я больше времени анализировал(а) проблему, а не поощрял(а) и одобрял(а) клиента"
87,прошлое,навыки тайм-менджмента,Я не опаздывал(а) к началу сессии
88,прошлое,интерпретации,"Я рассказывал(а) клиенту о том, что может значить его поведение или состояние с точки зрения той теории, которой я учился(лась)"
89,прошлое,челендж (работа с затруднениями),"Я ждал(а), когда клиент сам обнаружит свои внутренние противоречия и затруднения"
90,прошлое,пауза,Я не пользовался(лась) техникой терапевтических пауз на сессии
91,прошлое,челендж (работа с затруднениями),"Я не указывал(а) клиенту на его дисфункциональные процессы, убеждения или внутренние противоречия, чтобы не нарушить наши отношения"
92,прошлое,невербальные навыки,"Я подстраивался(лась) под позу, тембр и манеру речи клиента"
93,прошлое,концептуализация случая,Я не создавал(а) концептуализацию/модель случая клиента
94,прошлое,невербальные навыки,"Мне было трудно удерживать зрительный контакт с клиентом, это отвлекало от сути нашей беседы"
95,прошлое,обратная связь,"Когда клиент высказывал неудовлетворенность работой, я пытался(лась) переубедить его"
96,прошлое,челендж (работа с затруднениями),"Я обсуждал(а) с клиентом его затруднения, и мы вместе размышляли над тем, как их преодолеть"
97,прошлое,гибкость и адаптивность,"Я продолжал(а) использовать выбранные приемы работы, вне зависимости от того, что происходило на сессии"
98,прошлое,поддержка,Я говорил(а) клиентам слова одобрения и поддержки в процессе работы
99,прошлое,навыки тайм-менджмента,Я тщательно следил(а) за таймингом сессий
100,прошлое,конгруэнтность,"Я прикладывал(а) усилия, чтобы не показывать клиенту связанные с ним негативные эмоции"
101,прошлое,поддержка,"Я спрашивал(а) клиента о том, комфортно ли ему во время сессии"
102,прошлое,понятность,"Я использовал(а) стиль общения, которого придерживался клиент"
103,прошлое,оценка результатов,"Я ждал(а) полного решения проблемы, чтобы вместе с клиентом подвести итоги работы"
104,прошлое,прямое руководство,Я не предлагал(а) клиенту конкретных решений ситуации
105,прошлое,самооценка,"Я проводил(а) самостоятельный анализ сессий, чтобы лучше разобраться в случае клиента"
106,прошлое,эмпатия,"Я называл(а) чувства, переживаемые клиентом"
107,прошлое,самооценка,"Вне сессий я тренировал(а) свои профессиональные навыки (например, в группах, на тренингах и т.д.)"
108,прошлое,контекст,"Я не переключался(лась) на текущие потребности клиента, не связанные с выбранной целью"
109,прошлое,резюмирование сессии и результатов терапии c клиентом,Я не подводил(а) итогов на сессии
110,прошлое,самооценка,Я не анализировал(а) случай клиента между сессиями
111,прошлое,план сессии и отчет,После сессии я делал(а) записи по клиентскому случаю
112,прошлое,челендж (работа с затруднениями),"Я использовал(а) техники, помогающие клиенту преодолеть его дисфункциональные процессы и паттерны поведения"
113,прошлое,контекст,"Я следил(а) за тем, как менялось состояние клиента от начала к концу сессии"
114,прошлое,самооценка,Между сессиями я анализировал(а) качество терапевтического альянса
115,прошлое,прямое руководство,Я давал(а) клиенту домашние задания
116,прошлое,оценка результатов,Я не тратил(а) время сессии на оценку промежуточных результатов
117,прошлое,обратная связь,"Я обсуждал(а) с клиентом нашу работу, его удовлетворенность ею"
118,прошлое,альтернативные взгляды,"Я задавал(а) вопросы, направленные на расширение и дополнение видения ситуации клиентом"
119,прошлое,перефразирование и пересказ,Я не использовал(а) перефразирование
120,прошлое,пауза,"Я делал(а) паузы в разговоре, чтобы дать клиенту возможность побыть со своими мыслями и переживаниям"
121,прошлое,Поддержание результатов,"Я не акцентировал(а) внимание на успехах клиента и ждал(а), что он сам их заметит"
122,прошлое,пауза,"Я использовал(а) молчание, чтобы углубить контакт"
123,прошлое,самооценка,"На сессиях я действовал(а) интуитивно, не вдаваясь в детальный анализ своей работы"
124,прошлое,стимуляция,"Когда клиент дистанцировался и избегал говорить о чем-то, я старался(лась) вовлечь его в обсуждение"
125,прошлое,эмпатия,Я часто испытывал(а) теплые чувства и заботу по отношению к клиенту
126,прошлое,стимуляция,"Я просил(а) клиента подробнее рассказать о чувствах, которые он испытывает"
127,прошлое,конгруэнтность,"Я поддерживал(а) клиента, даже если чувствовал(а), что не хочу этого делать"
128,прошлое,навыки тайм-менджмента,Окончание сессии затягивалось на 10-15 минут 