order_original,orientation,competence_ru,question_ru
1,настоящее,Мультикультурность,Мне сложно работать с клиентом из-за его взглядов или культурных особенностей
2,настоящее,актуализация цели,"В своей работе я определяю только общее направление движения, без уточнения конкретных формулировок."
3,настоящее,конфиденциальность,"Я проговариваю устно, но не фиксирую письменно согласие о конфиденциальности терапии (чек бокс)"
4,настоящее,актуализация цели,Я не обсуждаю с клиентом цели на терапии
5,настоящее,обсуждение контракта,Я обсуждаю с клиентом критерии достижения общей цели нашей работы
6,настоящее,границы и правила,Я обсуждаю с клиентом факт нарушения установленных правил взаимодействия для обозначения терапевтических границ
7,настоящее,последовательность и фокус терапии,"Я работаю с ощущением безопасности клиента, прежде чем переходить к конфронтации с клиентом"
8,настоящее,границы и правила,"Я уделяю особое внимание проговариванию с клиентом правил взаимодействия: оплата, сеттинг и т.д."
9,настоящее,знание границ своей компетентности,"Я уточняю наличие симптомов тяжелых нарушений у клиента, чтобы вовремя перенаправить к подходящему специалисту"
10,настоящее,границы и правила,В начале терапии я сразу перехожу к обсуждению проблемы клиента и не трачу время на обсуждение правил взаимодействия
11,настоящее,информация о психотерапии,"Я не рассказываю клиентам об особенностях подхода, в котором работаю - они узнают об этом сами в процессе психотерапии"
12,настоящее,контекст,"Я спрашивал клиента, насколько работа с текущими переживаниями для него актуальнее, чем работа над целью"
13,настоящее,границы и правила,"Если клиент просит поменять время сессии, я иду ему навстречу"
14,настоящее,обсуждение контракта,Я обсуждаю цель работы с клиентом
15,настоящее,уместное самораскрытие,"Я раскрываю перед клиентом личный опыт, когда понимаю, что у нас крепкий терапевтический альянс"
16,настоящее,Распознавание разрывов в терапевтическом альянсе,"Я уточняю, с чем связаны изменения в поведении клиента на сессии (изменение интонации, непривычно долгое молчание и.т.д)"
17,настоящее,конфиденциальность,"Я принимаю меры, чтобы анонимность клиента была сохранена во время разбора случая на супервизии и интервизии"
18,настоящее,Мультикультурность,Я не работаю с людьми определенных национальностей или вероисповеданий
19,настоящее,Распознавание разрывов в терапевтическом альянсе,"Когда клиент закрывается в процессе терапии, я не пытаюсь его вовлечь в разговор, а жду инициативы от него"
20,настоящее,последовательность и фокус терапии,"Я не выделяю никаких этапов в психотерапевтической работе, она движется единым потоком"
21,настоящее,уместное самораскрытие,"Я делюсь своим опытом с клиентом, чтобы показать альтернативный способ мышления или действий"
22,настоящее,Распознавание разрывов в терапевтическом альянсе,"Я стараюсь восстановить контакт с клиентом, если замечаю, что он нарушается"
23,настоящее,межпрофессиональное сотрудничество,Я общаюсь на профессиональные темы преимущественно с коллегами из своего подхода
24,настоящее,информация о психотерапии,"Я не рассказываю клиентам про то, как действуют техники и упражнения, которые я применяю в работе с ними"
25,настоящее,саморегуляция,"Я выбираю и выражаю только те эмоции, которые считаю полезными для хода терапии"
26,настоящее,конфиденциальность,Я обсуждаю в профильных сообществах коллег в соцсетях случаи своих клиентов
27,настоящее,мотивация развиваться,Мне не хватает времени и сил следить за исследованиями в области психологии и смежных специальностей
28,настоящее,информация о психотерапии,"Я информирую клиентов об особенностях процесса психотерапии, поскольку считаю, что это важно для нашей работы"
29,настоящее,межпрофессиональное сотрудничество,"Я ищу контакты хороших специалистов в смежных профессиях, чтобы при необходимости перенаправить к ним клиента"
30,настоящее,последовательность и фокус терапии,"Прежде чем переходить к работе над целью, я уделяю время для формирования теплых, доверительных отношений с клиентом"
31,настоящее,межпрофессиональное сотрудничество,"Я интересуюсь знаниями в области биологии, социальных наук, медицины, антропологии, чтобы понимать контекст, в котором развивается моя практика"
32,настоящее,уместное самораскрытие,"Я спрашиваю разрешения у клиента, прежде чем рассказать о личном опыте"
33,настоящее,Профессиональные знания,"Я не употребляю психологические термины, чтобы не запутывать клиента"
34,настоящее,уместное самораскрытие,"Я ничего не рассказываю клиенту о себе, на терапии мы говорим о клиенте"
35,настоящее,Супервизия - личная терапия - интервизия,"Я осваиваю новые подходы самостоятельно, не прибегая к обучению у других специалистов"
36,настоящее,саморегуляция,"Я использую приемы саморегуляции, чтобы мои эмоции не мешали работе"
37,настоящее,конфиденциальность,Я подписываю с клиентом информированное согласие о конфиденциальности терапии (чек-бокс с 2-мя вариантами)
38,настоящее,информация о психотерапии,"Я рассказываю клиентам об особенностях подхода, в котором я работаю"
39,настоящее,Мультикультурность,"Цвет кожи, акцент в речи или внешний вид клиента мешают моей работе"
40,настоящее,Супервизия - личная терапия - интервизия,Я не ощущаю потребности в личной терапии
41,настоящее,мотивация развиваться,"Я предпринимаю специальные действия для профилактики эмоционального выгорания (супервизии, личная терапия, интервизии, группы и т.д.)"
42,настоящее,последовательность и фокус терапии,"Что бы ни происходило на сессии, я помню про поставленную нами цель"
43,настоящее,Распознавание разрывов в терапевтическом альянсе,"Я делаю выбор в пользу техник, работающих на цели клиента, а не техник работающих на отношения с клиентом"
44,настоящее,межпрофессиональное сотрудничество,Я общаюсь с коллегами из смежных профессий по рабочим вопросам
45,настоящее,сопротивление,"Когда клиент отказывается работать с какой-то техникой, я обсуждаю с ним возможность альтернативных вариантов"
46,настоящее,мотивация развиваться,Я изучаю актуальную повестку научных событий в своей области
47,настоящее,принятие,"Я с уважением отношусь к личности, мировоззрению, ценностям клиента и стараюсь продемонстрировать это"
48,настоящее,Мультикультурность,Я поддерживаю свою информированность в области мультикультурных особенностей
49,настоящее,принятие,"Если я считаю переживания клиента необоснованными, то сразу говорю ему об этом"
50,настоящее,Супервизия - личная терапия - интервизия,Я прохожу личную терапию для проработки собственных проблем и запросов
51,настоящее,мотивация развиваться,Я не провожу профилактику эмоционального выгорания
52,настоящее,последовательность и фокус терапии,"Если клиент перескакивает на тему, не связанную с первоначальным запросом, то я следую за ним"
53,настоящее,актуализация цели,"Я переформулирую и уточняю цели терапии, если это необходимо"
54,настоящее,Супервизия - личная терапия - интервизия,Я обращаюсь к интервизии и/или супервизии для рефлексии работы с клиентами
55,настоящее,сопротивление,"Если клиент пытается манипулировать мной, я замечаю и сообщаю ему об этом"
56,настоящее,знание границ своей компетентности,"Я пробую немедикаментозные способы помощи, прежде чем рекомендовать обратиться к специалистам по поводу медикаментозного лечения"
57,настоящее,актуализация цели,В своей работе я уделяю внимание проговариванию конкретных формулировок целей
58,настоящее,уместное самораскрытие,"Я нормализую переживания клиента, раскрывая перед ним свой опыт"
59,настоящее,сопротивление,"Если клиент не хочет работать с какой-то темой, то я соглашаюсь и не затрагиваю ее"
60,настоящее,знание границ своей компетентности,"Даже если у меня возникают сомнения по поводу какого-то клиента, я стараюсь сначала справиться сам(а), и только при ухудшении его состояния обращаюсь к другим специалистам"
61,настоящее,Профессиональные знания,"Я читаю дополнительную литературу, чтобы лучше разобраться в ситуации клиента"
62,настоящее,уместное самораскрытие,"Когда клиент задает вопросы обо мне, я отвечаю максимально подробно"
63,настоящее,Распознавание разрывов в терапевтическом альянсе,"Я обсуждаю с клиентом, как его пропуски и опоздания связаны с нашими с ним терапевтическими отношениями"
64,настоящее,актуализация цели,"Я обсуждаю результаты, которые хочет получить клиент в ходе терапии"
65,настоящее,Распознавание разрывов в терапевтическом альянсе,"Я замечаю, что клиент отстраняется, закрывается или уклоняется от содержания нашей беседы на сессиях"
66,настоящее,сопротивление,"Если я подозреваю у клиента наличие сопротивления, я задаю вопрос об этом"
67,настоящее,знание границ своей компетентности,"Я использую диагностические процедуры (интервью, опросники, мануалы), чтобы убедиться, что обладаю достаточной компетенцией для работы с клиентом"
68,настоящее,мотивация развиваться,Я посещаю конференции и участвую в них
69,настоящее,Мультикультурность,"Я не отказываюсь от работы с клиентом только по причинам, связанным с его гендерной идентичностью и сексуальной ориентацией"
70,настоящее,мотивация развиваться,Я не ощущаю необходимости в курсах повышения квалификации
71,настоящее,сопротивление,Я останавливаю попытки манипуляций со стороны клиента
72,настоящее,навыки тайм-менджмента,"Мне приходилось резко обрывать ход сессии, обращая внимание клиента на то, что время истекло"
73,настоящее,Мультикультурность,"Я стараюсь узнать больше об опыте клиента, связанном с его гендерной, этнической и др. идентичностью"
74,настоящее,уместное самораскрытие,"Я рассказываю клиенту о личном опыте применения упражнений и техник (например, практик внимательности), которые использую в терапии"
75,настоящее,саморегуляция,"Я отделяю чувства, которые переживаю в связи с процессом сессии, от своих личных переживаний"
76,настоящее,уместное самораскрытие,"Когда клиент задает вопросы обо мне, я избегаю ответа на них"
77,настоящее,актуализация цели,"Я поддерживаю в терапии актуальный процесс клиента, а не концентрируюсь на целях."
78,настоящее,Профессиональные знания,"Я не ищу дополнительную информацию, моих знаний хватает для работы с клиентами"
79,настоящее,Супервизия - личная терапия - интервизия,"Я обращаюсь к своим коллегам, чтобы обсудить возникающие в процессе консультирования проблемы (например, этические, эмоциональные и пр.)"
80,настоящее,Профессиональные знания,"Я объясняю клиентам некоторые психологические термины, которые считаю полезными для понимания ситуации"
81,настоящее,знание границ своей компетентности,"На первых сессиях я понимаю, могу ли помочь клиенту, или необходимо перенаправить его к другому специалисту"
82,настоящее,информация о психотерапии,"Я не рассказываю клиентам о том, как работаю, поскольку считаю, что это никак не повлияет на эффективность нашей работы"
83,настоящее,Профессиональные знания,"Я изучаю особенности применения техник (уместность, особенности и модификации разных упражнений)"
84,настоящее,обсуждение контракта,"Я не обсуждаю контракт с клиентом, поскольку этого не предполагает подход, в котором я работаю"
85,настоящее,конфиденциальность,Я согласовываю с клиентом возможность аудио/видео записи сессии (чек бокс)
86,настоящее,обсуждение контракта,"Я следую за текущими процессами клиента, не инициируя обсуждение целей нашей работы"
87,настоящее,информация о психотерапии,"Я объясняю клиенту цель и способ действия интервенций, которые я применяю"
88,настоящее,саморегуляция,"Негативные чувства и мысли, связанные с клиентом, не влияют на мою работу"
89,настоящее,обсуждение контракта,Я формулирую психотерапевтический контракт с клиентом
90,настоящее,последовательность и фокус терапии,"На каждой сессии я напоминаю клиенту о том, что происходило на предыдущей сессии"
91,настоящее,границы и правила,"Я допускаю общение с клиентом между сессиями, даже если мы об этом не договариваемся"
92,настоящее,Мультикультурность,"Я учитываю в работе культурные, религиозные и гендерные особенности клиента"
93,настоящее,Супервизия - личная терапия - интервизия,Я не прибегаю к супервизиям/интервизиям в своей работе
94,настоящее,саморегуляция,"Я не анализирую эмоции, возникающие у меня во время сессии"
95,настоящее,знание границ своей компетентности,"Я беру в работу клиента, даже если не учился(лась) работать именно с таким типом проблем"
96,настоящее,межпрофессиональное сотрудничество,"Я не интересуюсь спецификой смежных дисциплин (психиатрии, биологии, социальной работы и пр.)"
97,настоящее,Профессиональные знания,"Я не применяю новые приемы - лучше делать то, что уже хорошо знаешь"
98,настоящее,принятие,"Когда клиент плачет, я обращаю его внимание на позитивные стороны ситуации"
99,настоящее,последовательность и фокус терапии,Мы с клиентом совместно формулируем повестку сессии
100,настоящее,конфиденциальность,"Я не трачу время клиентов на обсуждение основ конфиденциальности, ведь клиенты и так знают, что могут доверить психотерапевту свои секреты (чек-бокс)"
101,настоящее,саморегуляция,"Если я испытываю негативные чувства по отношению к клиенту, я жду, когда они сами собой пройдут"
102,настоящее,обсуждение контракта,"В процессе терапии все быстро меняется, поэтому я не формулирую детализированный контракт о целях работы с клиентом"
1,прошлое,Поддержание результатов,Я замечал(а) даже малейшие положительные изменения у клиента и говорил(а) ему о них
2,прошлое,навыки тайм-менджмента,"Я оставлял(а) время, что бы мягко завершить сессию"
3,прошлое,эмпатия,"Я не отзеркаливал(а) чувства клиента, чтобы не вовлечься в его переживания и быть в состоянии помочь ему"
4,прошлое,гибкость и адаптивность,Я строго придерживался(лась) плана работы и действовал(а) согласно ему
5,прошлое,вопросы,"Сначала я собирал(а) как можно больше информации о жизни клиента, а потом думал(а), что из этого пригодится в работе"
6,прошлое,эмпатия,"Я не называл(а) чувства клиента, он сам должен осознавать и называть их"
7,прошлое,прямое руководство,Я использовал(а) рекомендации и предписания в своей работе
8,прошлое,резюмирование,Я не использовал(а) обобщение
9,прошлое,поддержка,Я использовал(а) невербальные способы поддержки клиента
10,прошлое,перефразирование и пересказ,"Я использовал(а) перефразирование, чтобы убедиться, что правильно понимаю клиента"
11,прошлое,принятие,"Я отказывался(лась) работать с клиентом, если чувстовал(а) конфликт ценностей"
